id	tokens
418	Reactive Programming with Eclipse Vert.x, Including 3.5.0, History, and Future Plans
419	Managed File Transfer (MFT) 2.0 with Fuse, 3scale and AMQ
420	5 Pillars of a Successful Java Web Application (Part 1/3)
421	Fall 2017 GNU Toolchain Update
422	JBoss Fabric Zookeeper Troubleshooting
423	More work done with less code – Fuse Online Tech-Preview TODAY
424	Build your Software Defined Data Center with Red Hat CloudForms and Openstack – part 2
425	Build your Software Defined Data Center with Red Hat CloudForms and Openstack – part 1
426	Getting started with llvm-toolset
427	Getting started with rust-toolset
428	Getting started with go-toolset
429	Docker Authentication with Keycloak
430	10 Steps to Cloud happiness – Introduction
431	Creating A Better Responsive Design in Web Development
432	SSL Testing Tool
433	How to configure persistent storage with OpenShift or Kubernetes for development environment
434	3scale API Management Simplifies OpenID Connect Integration
435	Android SPKI Pinning with TrustKit
436	How to monitor an Eclipse MicroProfile 1.2 server with Prometheus
437	PHP Configuration Tips
438	Announcing release of Software Collections, Developer Toolset, new compilers
439	Tutorial: Building and consuming Virtual Microdatabase with JBoss Data Virtualization
440	JShell Step by Step
441	vSphere Cloud provider and VMDK dynamic provisioning
442	Data Streaming with WildFly Swarm and Apache Kafka
443	Low-risk Monolith to Microservice Evolution Part II
444	First steps in integration of Windows and Linux Containers in OpenShift
445	Remote debug your ASP.NET Core container on OpenShift with Visual Studio Code
446	ASP.NET Core Hello World Explained
447	Kubernetes and OpenShift Meetup (7th October)
448	A MicroProfile-based microservice on OpenShift Container Platform – Part 3
449	How to start multiple Artemis brokers inside Red Hat JBoss EAP-7 container in Master/Slave fashion
450	About When Not to Do Microservices
451	Jug Summer Camp 2017, Vert.x and collaborative DJ mix
452	OpenID Connect Identity Brokering with Red Hat Single Sign-On
453	JBoss: Developer’s Guide
454	YAML Language Server and the Extension for VS Code
455	Use Software Collections without Bothering with Alternative Path
456	What is a Socket?
457	Container Images for OpenShift – Part 4: Cloud readiness
458	The Monitoring aspects of Eclipse MicroProfile 1.2
459	Container Images for OpenShift – Part 3: Making your images consumable
460	Guide to starting use AWX on top of OpenShift, the upstream of Red Hat Ansible Tower
461	Server-side Kotlin with Eclipse Vert.x at JavaOne
462	How to quick install Red Hat Mobile on Openshift
463	Container Images for OpenShift – Part 2: Structuring your images
464	The NEW API Pattern
465	Container Images for OpenShift – Part 1: Objectives
466	Monoliths to Microservices
467	Running a NuGet server on OpenShift
468	Fuse development environment with Development Suite installer
469	Red Hat Developers at EclipseCon Europe
470	JBoss A-MQ on OpenShift Cheat Sheet
471	An Overview of the New JDK 9 Release
472	Using Falcon to cleanup Satellite host records that belong to terminated OSP instances
473	Java code coverage in Eclipse
474	Entropy in RHEL based cloud instances
475	JDBC Master-Slave Persistence setup with Activemq using Postgresql database.
476	Configuring Spring Boot on Kubernetes with Secrets
477	Red Hat adds Go, Clang/LLVM, Rust compiler toolsets; updates GCC
478	Red Hat updates Python, PHP, Node.js, more; supports new arches
479	Configuring Spring Boot on Kubernetes with ConfigMap
480	How to use JShell: An Command Line tool introduced in JDK 9
481	Configuring Spring Boot Application on Kubernetes
482	Handling Exception Scenarios in REST API developed using JAX-RS
483	How to enable/disable repository using Subscription Manager or Yum-Utils
484	Automated Open vSwitch PVP testing
485	The Reactive Landscape
486	Openshift 3.6 Reference Architecture Now Includes SSO
487	Java Language Support for Visual Studio Code enters the Million Downloads Club
488	Low-risk Monolith to Microservice Evolution Part I
489	Transactions for Microservices? Really?
490	Stack Clash Mitigation in GCC — Background
491	Connecting Kubernetes and Docker
492	How Kubernetes Helps to Enable DevOps
493	Using Agile Integration for IoT
494	Manage test dependencies with Go
495	Connecting .NET Core to D-Bus
496	Using New Relic in Red Hat Mobile Node.js Applications
497	VLAN filter support on bridge
498	Know how RESTful your API is: An Overview of the Richardson Maturity Model
499	Red Hat to sponsor .NET Conf virtual conference – Sept 19-21
500	JBoss Developer’s Guide Book is out
501	Profiling NodeJS applications with Linux Performance Tools
502	Camel Clustered File Ingestion with JDBC and Spring
503	A walk down the Red Hat lane
504	Continuous Integration: A “Typical” Process
505	Using .NET Core 2.0 and RHEL in Linux Containers
506	On link modeling, network emulation and its impacts on applications
507	Code Maintenance
508	Snag an IoT kit at CodeStarter at RHTE APAC
509	Red Hat at the ISO C++ Standards Meeting (July 2017): Parallelism and Concurrency
510	A MicroProfile-based microservice on OpenShift Container Platform – Part 2
511	A MicroProfile-based microservice on OpenShift Container Platform – Part 1
512	The Skinny on Fat, Thin, Hollow, and Uber
513	Getting Started with Global Beans in Fuse Tooling 10.0.0
514	Quick Introduction of .NET Core 2.0
515	Red Hat Releases .NET Core 2.0
516	Gluster for OpenShift – Part 1: Container-Ready Storage
517	Openshift on a Nuc shell
518	Integrating PicketLink with OKTA for SAML based SSO
519	Troubleshooting Java applications on OpenShift
520	Introduction to NuGet with .NET Core on RHEL
521	Red Hat Releases New Development Tools
522	Announcing Red Hat Developer Studio 11.0.0.GA and JBoss Tools 4.5.0.Final for Eclipse Oxygen
523	Microsoft releases .NET Core 2.0
524	How to run FIS 2.0 application using  source S2I deployment procedure
525	Using Clustered Camel Quartz Jobs on JBoss EAP
526	Why Infrastructure Parity Matters for Developers Too
527	TDC Sao Paulo 2017 and containers quality tests
528	Demonstrating Red Hat JBoss AMQ 7 HA Replication Failover
529	Organizing Microservices – Modern Integration
530	Getting started with Kompose
531	The Perils Of The Bleeding Edge in .NET Core
532	Advanced Microservices with .NET
533	Summer 2017 GNU Toolchain Update
534	Kill Your API : The Burger Analogy
535	OpenShift 3.6 – Release Candidate (A Hands-On)
536	Reference Architecture for Agile Integration
537	6 Reasons why I started using containers
538	Testing REST APIs with REST Assured
539	EDI Transformations with Fuse Integration Services (FIS)
540	DevNation Live Webinar Series: Going Reactive with Java
541	The Dark Side: How Hackers are  Manipulating Our World
542	Testing your Android App’s UI with Espresso
543	Upgrading to Vaadin Framework 8 (Part 2 of 2)
544	How to debug your mobile hybrid app on iOS
545	Five OpenShift Development Environments in Five Minutes
546	Statement Frontier Notes and Location Views
547	Using OpenTracing with Jaeger to collect Application Metrics in Kubernetes
548	Configuring Containerized Services
549	MicroProfile: Optimizing Enterprise Java for a Microservices Architecture
550	Upgrading to Vaadin Framework 8 (Part 1 of 2)
551	Visualizing Smog Sensor Data with the help of Vert.x, Prometheus, and Grafana
552	OpenShift Application Runtimes
553	After Years of Linux on ARM, when is the Year of Red Hat on ARM servers?
554	Developing Mobile Applications using TypeScript on Red Hat Mobile Application Platform
555	Red Hat at the ISO C++ Standards Meetings (November 2016, Issaquah, and February 2017, Kona): Library
556	5 Things to Know About Reactive Programming
557	Building Containerized IoT solutions on OpenShift Lab
558	Agile Software Development – The Red Hat Way
559	What’s new in MACsec: setting up MACsec using wpa_supplicant and (optionally) NetworkManager
560	OVS-DPDK Parameters: Dealing with multi-NUMA
561	Red Hat at the ISO C++ Standards Meeting (April 2017, Kona): Core Language
562	Open vSwitch: QinQ Performance
563	The Evolution of Technology in the Context of Software Development & Design Process: Take-away from PatternFly Conference
564	Innovating on Developers Events, Building the API Escape Room
565	Reactive Programming with Vert.x
566	The Diamond in the Rough: Effective Vulnerability Management with OWASP DefectDojo
567	Building a Secure IoT Solution: Summit 2017
568	12 Factors to Cloud Success
569	Live Coding Reactive Systems w/Eclipse Vert.x and OpenShift
570	Documentation as Code
571	How to implement a new realm in Tomcat
572	Running CDK 3.0 on Fedora 25
573	.NET Core Magic: Develop on one OS, run on another
574	It’s Tuesday… Jenkins is down
575	Red Hat at the ISO C++ Standards Meeting (March 2017): Parallelism and Concurrency
576	RESTful Services
577	Core Values of Every Tech Team
578	From Java to .Net Core, Part 2: Types
579	Coding EJB clients for JBoss EAP 7.1
580	Local Development Setup for Red Hat Mobile using Docker
581	Your first Business Rules application on OpenShift: from Zero to Hero in 30 minutes
582	Running HPC workloads across multiple architectures with Red Hat Enterprise Linux
583	Working with peer, scoped and private npm dependencies in RHMAP
584	Debugging RHMAP Apps locally with Visual Studio Code (VS Code)
585	The rise of Agile Integration, Integration is not DEAD nor LAME!
586	The need for speed and the kernel datapath – recent improvements in UDP packets processing
587	How To Setup A Redis Server Cluster on Red Hat
588	Short Retry vs Long Retry in Apache Camel
589	Microservices Patterns With Envoy Proxy, Part III: Distributed Tracing
590	New level of automation with Ansible
591	Red Hat and Apache OpenWhisk
592	Writing a Linux daemon in C#
593	Open vSwitch: Overview of 802.1ad (QinQ) Support
594	IoT Hackathon –  CodeStarter @ Red Hat Summit
595	Technical How-to Books for Developers – Microservices, Design Patterns, .NET, Reactive, Databases
596	Measuring and comparing Open vSwitch performance
597	Why I started using containers
598	Installing Node.js dependencies with Yarn via s2i builds and OpenShift
599	Managing Windows Updates with Ansible in RedHat 7.3
600	Microservices Patterns With Envoy Proxy, Part II: Timeouts and Retries
601	Scaling Sync
602	Microservices Patterns With Envoy Sidecar Proxy, Part I: Circuit Breaking
603	18 Recorded Sessions on Cloud Native Development – from Red Hat Summit
604	Brief Interview with James Kirkland about IoT
605	Red Hat Container Development Kit 3.0
606	Everything you wanted to know about a Red Hat Summit Lab
607	Implementing a Log Collector using Red Hat JBoss Fuse and Red Hat JBoss Data Grid
608	How to Setup your Apps to Target Locally on Device
609	Easily secure your Spring Boot applications with Keycloak
610	Why Red Hat is acquiring Codenvy – Expanding our cloud-native app dev portfolio
611	Everyware Software Framework (ESF) 5.0
612	Graphical Camel Debug for Servers and Cloud Deployments Architecture in Fuse Tooling 9.2.0
613	Now available – Red Hat Software Collections 2.4 and Red Hat Developer Toolset 6.1
614	Containerizing open-vm-tools – Part 2: Atomic CLI and Converting to a Systems Container
615	Red Hat announces new development tool updates: DevSuite, DevStudio, and CDK
616	Technical Cheat Sheets for Developers
617	JBoss Tools and Red Hat Developer Studio Maintenance Release for Eclipse Neon.3
618	HOW-TO setup a 3scale AMP on-premise all-in-one install
619	WannaCry Ransomware: Who It Affected and Why It Matters
620	Fighting Service Latency in Microservices with Kubernetes
621	Riviera Dev/JUDCon: Riviera 2017 Recap
622	From Java to .Net Core. Part 1
623	Trip Report: April 2017 WG14 Meeting
624	It takes more than a Circuit Breaker to create a resilient application
625	OpenShift and DevOps: The CoolStore Microservices Example
626	Unlock Your Cloudera Data with Red Hat JBoss Data Virtualization
627	Auto Scaling
628	Collaborating as a Team
629	ELK Exploration Companion
630	Breaking up the Container Monolith
631	Using OpenShift with AWS Services and Features
632	The Truth about Microservices
633	Mastering deployments with Kubernetes & OpenShift
634	Achieving Deployment Excellence with Red Hat OpenShift.io
635	Blueprint for Modern Application Architecture
636	Continuously Building a Book
637	OpenShift.io Developer Tools Overview – Summit 2017 – The Power of Cloud Workspaces – Part 2
638	OpenShift.io The Gathering – Summit 2017 – Developer Tools, Overview and Roadmap Part I
639	7 Freaking Awesome things about OpenShift.io
640	Increasing developer confidence and reducing development risk with Red Hat OpenShift.io Analytics
641	University Connect Program – RIT, Islampur
642	The Power of Cloud Workspaces in Red Hat OpenShift.io
643	Red Hat OpenShift.io: An end-to-end, cloud-native, team development experience
644	Announcing Red Hat OpenShift.io
645	Using JBoss DataGrid in Openshift PaaS
646	Start evaluating Red Hat JBoss EAP 7 in less than 1 minute
647	Develop and Deploy on OpenShift Next-Gen using Red Hat JBoss Developer Studio (Part 2)
648	Summit Book Signing: The Foundation for an Open Source City
649	Summit Book Signing: From Pots and Vats to Programs and Apps
650	Infinispan’s Java 8 Streams Capabilities
651	What’s new in Red Hat JBoss Data Grid 7.1!!!!!
652	Play in the Developer Cup Game at Red Hat Summit – get more swag
653	Dynamic Persistent Storage Using the Red Hat Container Development Kit 3.0
654	O’Reilly Authors are Heading to Summit – microservices, raspberry pi hacks, .NET and more.
655	How to Get Developers to Adopt Your Product
656	New Distributed Primitives for Developers
657	Open Source is Everywhere !!!
658	Projects from the Open Source World
659	Advanced Linux Commands Cheat Sheet is Here
660	DevNation Federal – Washington, DC June 8, 2017
661	Enabling LDAP Security for DataGrid Cache
662	Using Snyk, NSP and Retire.JS to Identify and Fix Vulnerable Dependencies in your Node.js Applications
663	Perform hands-on, real-world IoT development at the Red Hat Summit IoT CodeStarter
664	Red Hat Summit 2017 – Planning your Cloud and Containers Labs
665	40+ Cloud Native Development sessions/labs/demos at Red Hat Summit
666	Benchmarking nftables
667	The Shadow Man on Our campus
668	Working with a Dispersed Team – Part 7 of 7
669	Creating Your First .NET Program on Red Hat Enterprise Linux
670	Develop and Deploy on OpenShift Next-Gen using Red Hat JBoss Developer Studio
671	Red Hat Summit 2017 is for developers
672	Working with a Dispersed Team – Part 6 of 7
673	Adding Persistent Storage to the Container Development Kit 3.0
674	No cost. No hassle. Plenty of RHEL developer benefits!
675	Developers at Red Hat Summit: announcing API Escape Room
676	Working with a Dispersed Team – Part 5 of 7
677	Direct Kernel Open vSwitch Flow Programming
678	Working on Dispersed Teams  – Part 4 of 7
679	Adding Persistent Storage to Minishift / CDK 3 in Minutes
680	Working on Dispersed Teams – Part 3 of 7
681	OpenJDK and Containers
682	Working on Dispersed Teams – Part 2 of 7
683	Red Hat Summit 2017 – Planning your AppDev & DevOps labs
684	Offload your database data into an in-memory data grid for fast processing made easy
685	Working on Dispersed Teams – Part 1 of 7
686	Connection fail-over if the db-user is locked out
687	Service Workers in the Browser (Not Clerks The Movie)
688	7 Things to Worry About w/Microservices
689	Congratulations to Winners of Open IoT Challenge 3.0
690	A Beginners Guide to DSL Writing in Ruby
691	Push Notifications to the Right People and Devices
692	What’s .NEW in .NET, Volume 1
693	A Decade in the Open Organization
694	Sharing between Windows 10 and your VM
695	Containerizing open-vm-tools – Part 1: The Dockerfile and constructing a systemd unit file
696	Apache Ant – quick start
697	Writing Sleek Functions
698	Sprint 2017 GNU Toolchain Update
699	JBoss participates in Google Summer of Code 2017
700	Basics of Go in Fedora
701	Diagnosing Function Pointer Security Flaws with a GCC plugin
702	Naming Matters
703	Installing Linux on an Android Phone
704	A Post Mortem on Madness, or Why Process Matters
705	Why Software Documentation is the Next Big Thing
706	Preparing CentOS 6.8 for Work
707	Java inside docker: What you must know to not FAIL
708	Basic Camel and HTTPS
709	C/C++ library upgrades and opaque data types in process shared memory
710	-Wimplicit-fallthrough in GCC 7
711	Developers, join us at Red Hat Summit!
712	Node, S2I and Docker
713	Versions in Versions in Versions, AKA The .NET Core Russian Doll
714	How to set up a LAMP stack on Red Hat Enterprise Linux 7
715	External materialized views demystified in Red Hat JBoss Data Virtualization and Red Hat JBoss Data Grid
716	Wearable Tech: A Developer’s Security Nightmare
717	Reorder your Camel components graphically with Fuse Tooling 9.1.0
718	How to start development of Camel routes based on Fuse Integration Services from Fuse Tooling
719	Malloc Internals and You
720	The Year of Data Breaches: Why Encryption and Reformatting SSD’s is Not Enough
721	Announcing Red Hat Development Tools Updates
722	Using Red Hat Container Development Kit 3 Beta
723	ABI change analysis of Fedora packages
724	Edit, Compile and Debug .NET on Linux using VS Code
725	Towards Faster Ruby Hash Tables
726	Developing for IoT?  Take this Eclipse survey
727	Getting started with OpenShift Java S2I
728	OpenShift for Developers: Set Up a Full Cluster in Under 30 Minutes
729	How to Build a Stratum 1 NTP Server Using A Raspberry Pi
730	Memory Error Detection Using GCC
731	Announcing Fuse for agile integration on the cloud – FIS 2.0 release
732	An Incremental Path to Microservices
733	Unlock your Red Hat JBoss Data Grid data with Red Hat JBoss Data Virtualization
734	Five-Day Sprint Process meets Raleigh Innovators Program – Part 5 of 5
735	Improving User Experience using The Cloud
736	Five-Day Sprint Process meets Raleigh Innovators Program – Part 4 of 5
737	Find what capabilities an application requires to successful run in a container
738	Five-Day Sprint Process meets Raleigh Innovators Program – Part 3 of 5
739	Download A-MQ 7 Beta 2 today!
740	Testing… Testing… GCC
741	Five-Day Sprint Process meets Raleigh Innovators Program – Part 2 of 5
742	How to build a containerized IoT solution with OpenShift
743	Five-Day Sprint Process meets Raleigh Innovators Program – Part 1 of 5
744	Unlock your Microsoft Excel data with Red Hat JBoss Data Virtualization
745	PowerShell on RHEL in One Minute
746	The Evolution of a Linux Container
747	Creating your first ASP.NET MVC web site on RHEL
748	Programmatic Debugging: Part 1 the challenge
749	The Camel Rest DSL
750	Adding buffer overflow detection to string functions
751	Coala, setting it up and auto patching
752	October 2016 ISO C Meeting Report
753	Microservices: Zero Downtime Deployment; Hot reconfiguration on OpenShift
754	Mobile Apps Load Testing
755	Red Hat JBoss Data Virtualization on OpenShift: Part 4 – Bringing data from outside to inside the PaaS
756	Container Images Compliance – what we built at ManageIQ to remove a security pain point – part 2
757	Container Images Compliance – what we built at ManageIQ to remove a security pain point – part 1
758	End To End Encryption With OpenShift Part 1: Two-Way SSL
759	How to start with Containers and OpenShift for newcomers in Red Hat Enterprise Linux 7
760	Using Perl 5.24 Red Hat Software Collection
761	Microservices Deployments Evolution
762	Running Spark Jobs On OpenShift
763	Manage your Mongo Databases in RHMAP with Mongo Express
764	Getting Started with Microsoft SQL Server on Red Hat Enterprise Linux
765	Red Hat JBoss Data Virtualization on OpenShift: Part 3 – Data federation
766	Red Hat Releases New Versions of DevStudio, CDK, and DevSuite
767	Securing Fuse 6.3 Fabric Cluster Management Console with SSL/TLS
768	Spring Cloud for Microservices Compared to Kubernetes
769	Observations on Porting from .NET Framework to .NET Core
770	Red Hat JBoss Data Virtualization on OpenShift: Part 2 – Service enable your data
771	Unlock your MariaDB/MySQL data with Red Hat JBoss Data Virtualization
772	Looking for DevNation 2017 CFP
773	Red Hat JBoss Data Virtualization on OpenShift: Part 1 – Getting started
774	Configuring and Using Persistent Memory in RHEL 7.3
775	Calling A-MQ Deployed in OpenShift by an External Client
776	Integrating WebSphere MQ with JBoss Enterprise Application Server
777	Kompose Up for OpenShift and Kubernetes
778	Installing Red Hat Container Development Kit on Fedora
779	Red Hat adds .NET Core 1.1 to Red Hat Enterprise Linux and Red Hat OpenShift Container Platform
780	What’s New in Red Hat JBoss BRMS and BPM Suite 6.4
781	The Open IoT Challenge Is On!  Submissions now due November 30
782	Announcement: Red Hat JBoss Data Virtualization on OpenShift now available
783	Using the Kubernetes Client for Go
784	Deliver support for new languages in Eclipse IDE faster with Generic Editor and Language Servers
785	Working with OpenShift secrets for ASP.NET Core
786	November 2016 GNU Toolchain Update
787	How To Setup Integration & SOA Tooling For JBoss Developer Studio 10
788	What is mobile security?  What is the mobile security ecosystem?
789	Red Hat Summit, DevNation, and an Application Development call for papers
790	Automating microservices deployment with Ansible
791	A step-by-step tutorial for continuous integration with Jenkins for a Red Hat Mobile Native iOS application
792	Getting started with Apache Camel and the Internet of Things
793	Unlock your Hadoop data with Hortonworks and Red Hat JBoss Data Virtualization
794	Understanding OpenShift Security Context Constraints
795	Red Hat Software Collections 2.3 now beta
796	New Red Hat Developer Toolset 6 now in beta
797	Red Hat JBoss Developer Studio on MacOS X- an alternative setup
798	That app you love, part 8: A blueprint for “that app you love”
799	Integrating Red Hat OpenStack 9 Cinder Service With Multiple External Red Hat Ceph Storage Clusters
800	Looking inside open source innovation
801	Release of v3.14 of the Red Hat Mobile Application Platform
802	That app you love, part 7: Wired for sound
803	How To Setup Fuse Tooling For JBoss Developer Studio 10
804	MACsec: a different solution to encrypt network traffic
805	13 Red Hat sessions at Devoxx Belgium
806	Announcing fully containerized Red Hat Mobile Application Platform 4.2
807	Getting started with Red Hat Enterprise Linux development on Parallels Desktop
808	That app you love, part 6: Container, meet cloud
809	Tracing packets inside Open vSwitch
810	Four creative ways to create an OpenShift/Kubernetes dev environment
811	That app you love, part 5: Upping our (cloud) game
812	Business process management in a “microservices world”
813	Using API keys securely in your OpenShift microservices and applications
814	Fuse and A-MQ version 6.3 GA are released!
815	That app you love, part 4: Designing a config-and-run container
816	JBoss Fuse Tooling released for Eclipse Mars
817	C++ support in libcc1: A comprehensive update
818	Micro-rules on OpenShift: The CoolStore just became even cooler!
819	How Red Hat re-designed it’s Single Sign On (SSO) architecture, and why.
820	That app you love, part 3: Every setting in its place
821	Red Hat and Eclipse IDE, looking back at Neon and forward at Oxygen
822	Messaging as a Service on OpenShift
823	Containerizing an application for the cloud: A journey of settings, state, and security.
824	Lessons learned from using IoT devices in the real world
825	That app you love, part 2: Immutable but flexible – What settings matter?
826	Migration of Red Hat Enterprise Linux 5 or 6 to Red Hat Enterprise Linux 7 with the Preupgrade Assistant
827	Video: Monitoring application events in Thermostat, using Byteman
828	That app you love, part 1: Making a connection
829	Logging in Open vSwitch
830	Survey: What do you care about internationalization and localization, anyway?
831	Development workflows with Fuse Integration Services (FIS)
832	DevStudio 10.1, CDK 2.2, DevSuite 1.1 – all now generally available
833	How this year’s Google Summer of Code ended up for JBoss and Vert.x
834	Managing temporary files with systemd-tmpfiles on RHEL7
835	Java Language Support for Visual Studio Code has landed
836	Writing Microservices: An Example Through a Simple To-Do Application
837	Red Hat Open Innovation Labs: Automating CI/CD Deployment Pipelines
838	P/Invoke in .NET Core on Red Hat Enterprise Linux
839	Microservices CI/CD Pipelines in Openshift
840	Using Jenkins in the Red Hat CI/CD Ecosystem
841	Running systemd in a non-privileged container
842	High Availability Servlets with EAP 7 and OpenShift
843	Five features of JBoss EAP that help you get production ready
844	Top 10 “Yum” installables to be productive as a developer on Red Hat Enterprise Linux
845	Red Hat JBoss Data Virtualization 6.3 wins Database Trends and Applications Reader Choice 2016 Award for Best Data Virtualization Solution.
846	What’s new in Red Hat JBoss Data Virtualization 6.3
847	A simple guide to provisioning Vagrant boxes with Ansible
848	Four best practices for securing Red Hat Enterprise Linux
849	Debugging .NET on Red Hat Enterprise Linux from Visual Studio
850	Putting the “Micro” in Microservices with WildFly Swarm
851	Intel Joule Debate: A maker platform ready for widespread IoT use?
852	How to install and configure Jenkins to build .NET apps on Red Hat Enterprise Linux
853	Using the operating system to authenticate users on Red Hat JBoss Enterprise Application Platform (EAP) ?
854	How to install and configure Ansible on Red Hat Enterprise Linux
855	Six popular incident management tools for Red Hat Enterprise Linux
856	Using Visual Studio with Linux (Hint: Windows is still required)
857	Release of v3.13 of the Red Hat Mobile Application Platform
858	August 2016 GNU Toolchain Update
