id	tokens
859	Why Red Hat’s new ‘dnf’ package manager is not “just another ‘yum'”
860	CI Security on Red Hat Enterprise Linux from a Windows Perspective
861	Using Red Hat JBoss Developer Studio to Debug Java Applications in the Red Hat Container Development Kit
862	Use these six simple steps to get started with Red Hat JBoss Business Resource Planner
863	What’s New in Jenkins 2.0
864	Setting up a LAMP stack on Red Hat Enterprise Linux
865	Lightweight Application Instrumentation with PCP
866	Provisioning Vagrant boxes using Ansible
867	Build your next cloud-based PaaS in under an hour
868	Red Hat Software Collections: Why They’re Awesome, and How to Use Them
869	Setting up KVM on Red Hat Enterprise Linux
870	12 Simple Tips for Your Next Highly Available Cloud Buildout
871	RHEL, DNX, and Azure Service Bus
872	Why should I use Node.js: The Non-blocking Event I/O Framework?
873	Deploying Microservices on OpenShift using Kubernetes
874	Install Ansible on Red Hat Enterprise Linux
875	JBoss EAP 7 Domain deployments – Part 4: Domain deployment with REST Management API.
876	Get it done with these 5 techniques to debug your JBoss BRMS applications
877	A step-by-step tutorial for continuous integration with Jenkins on a Red Hat Mobile Native Android application: Part 2
878	JBoss EAP 7 Domain deployments – Part 3:  Domain deployment with Common Language Interface CLI.
879	Persistence vs. Durability in Messaging. Do you know the difference?
880	A step-by-step tutorial for continuous integration with Jenkins for a Red Hat Mobile Native Android application: Part 1
881	Are “Web Components” in the future for PatternFly?
882	Red Hat Keynote Mobile App
883	JBoss EAP 7 Domain deployments – Part 2:  Domain deployments through the EAP 7.0 Management Console
884	Release of v3.12 and v4.1 of the Red Hat Mobile Application Platform
885	It’s a wrap! dotnetConf 2016 Japan
886	What’s new with the Red Hat Developer Program?
887	The Hardest Part About Microservices: Your Data
888	Keeping track of my subscriptions using the Red Hat Content Delivery Network API
889	It’s a wrap! Thank you TDC São Paulo 2016
890	A week of hacking the Java Language Server
891	Considerations for Implementing JBoss Fuse in your Enterprise
892	PostgreSQL and MongoDB Software Collections: Three easy steps to get started
893	JBoss EAP 7 Domain deployments – Part 1: Set up a simple EAP Domain
894	Have your own Microservices playground
895	Announcing Red Hat JBoss Data Grid 7
896	Connecting to a Remote database from a JWS/Tomcat application on OpenShift
897	Continuous Delivery to JBoss EAP and OpenShift with the CloudBees Jenkins Platform
898	Gems: A Few Helpful dotnet commands
899	﻿The Benefits of Red Hat Enterprise Linux for Real Time
900	Debugging Java Applications using the Red Hat Container Development Kit
901	From Fragile to Antifragile Software
902	Effective Business Process Management with JBoss BPM (MEAP)
903	Introducing Business Process Management with JBoss BPM
904	Red Hat at the ISO C++ Standards Meeting (June 2016, Oulu): Library
905	JBoss EAP 7 on OpenShift
906	Unit-testing your BPM processes by bending time.
907	A-MQ 7 Alpha is ready!
908	Red Hat at the ISO C++ Standards Meeting (June 2016, Oulu): Parallelism and Concurrency
909	Where have all my subscriptions gone?
910	Red Hat at the ISO C++ Standards Meeting (June 2016, Oulu): Core Language
911	Account Management with JBoss BPM Suite
912	Installing JBoss EAP 7 on RHEL using RPMs
913	A Mongo Shell Cheat Sheet
914	Help, I accidentally hit CTRL-ALT-F8 on my Red Hat Enterprise LInux VM on Hyper-V!
915	Seven must try user experience tactics for developers
916	Carving the Java EE Monolith Into Microservices: Prefer Verticals Not Layers
917	Release of v3.11 of the Red Hat Mobile Application Platform
918	Brace yourselves! TDC São Paulo is coming with Red Hat Developers
919	Offline CLI with JBoss EAP 7
920	DevNation Live Blog: fabric8-ing Continous Improvement with Kubernetes and Jenkins Pipeline
921	Summit Live Blog: Middleware security: Authentication, authorization, and auditing services
922	DevNation Blog:  End-to-end OpenSCAP for automated compliance
923	DevNation Live Blog: Drools 7.X Happenings and Roadmap
924	DevNation Live Blog: Meet the assertable Chaos Monkeys for your Docker system
925	DevNation Live Blog: DevOps moves to production
926	Summit Live Blog: Building Exascale Active Archives with Red Hat Ceph Storage
927	Four different approaches to run WildFly Swarm in OpenShift
928	DevNation Live Blog: Agile is a four-letter word
929	DevNation Live Blog:  Decomposing a Java EE Monolith into WildFly Swarm Microservices
930	DevNation Live Blog: Cryptography: What every application developer needs to know
931	DevNation Live Blog: Building Reactive Applications with Node.js and Red Hat JBoss Data Grid
932	DevNation CodeStarter – a evening of IoT hacking with Eurotech
933	Push it Real Good: Continuous Delivery for the people at the push of a button and repo
934	DevNation Live Blog: You’ve got microservices… Let’s secure them
935	DevNation Live Blog: Make applications great again: OpenShift Enterprise 3 walk-through with Docker and Kubernetes
936	DevNation Live Blog: Container development for command line developers
937	DevNation Live Blog: Analyzing Java applications using Thermostat
938	DevNation Live Blog: Open source IoT gateway: A tale of Eclipse Kura, Apache Camel, and RHIoT
939	DevNation Live Blog: Java 9 modularity in action
940	DevNation Live Blog: Developing with OpenShift without the build waits
941	Code Healthy with the OpenShift Hackathon
942	Docker Containers “Cheat Sheet” now available!
943	DevNation Live Blog: CDK 2.0: DOCKER, KUBERNETES, AND OSE ON YOUR DESK
944	DevNation 2016 Keynote Recap
945	Sign up for the Stack Overflow Assistance pilot
946	.NET Core Now Available and Supported on Red Hat Enterprise Linux and Red Hat OpenShift
947	Red Hat & Eclipse Che
948	A common interface for building developer tools
949	MicroProfile – Collaborating to bring Microservices to Enterprise Java
950	Announcing JBoss EAP 7
951	Celebrating 10 years of application development solutions at Red Hat
952	Red Hat Container Development Kit 2.1
953	An Announcement for JBoss Core Services Collection
954	OpenJDK now available for Windows
955	Thank you The Developer’s Conference Florianópolis and DevCamp for receiving us!
956	The Hypothesis Testing Library for Python: An Introduction
957	Node.js 4.4, Python 3.5, and Ruby 2.3 Get Started guides on developers.redhat.com
958	How to run Java fat-jars in Docker, Kubernetes and Openshift
959	Announcing our DevNation Free Pass Contest Winner!
960	A Lesson in Debugging: Big Projects Have Critical Bugs Too
961	Sign up for the Red Hat Developer Program newsletter
962	Create Resilient Camel applications with Hystrix
963	Node.js – Harnessing the power of Java (for PDF generation and more)
964	DevNation 2016 General Session to open with Microsoft’s Scott Hanselman
965	April/May 2016 GNU Toolchain Update
966	Simplifying ASP.NET applications on OpenShift with the ASP.NET Core S2I Builder
967	Congratulations to Last Week’s DevNation Free Pass Winners!
968	DevNation 2016: Nick Coghlan and Graham Dumpleton on Python Development
969	DevNation 2016: Galder Zamarreno on “Building reactive applications with Node.js and Red Hat JBoss Data Grid”
970	Launching Red Hat Mobile Application Platform 4.0,  enterprise mobility to the next level
971	DevNation 2016: Paul Bakker and Sander Mak discuss “Java 9 modularity in action”
972	How to Set Up A Kubernetes Developer Box
973	DevNation 2016: Tim Pettersen on “Tracking huge files with Git LFS”
974	How to Install Elastic Stack (ELK) on Red Hat Enterprise Linux (RHEL)
975	DevNation 2016 – Magic: The Gathering – Mini-Tourney
976	Google joins DevNation 2016 CodeStarter with Google Cloud Platform – time to hack on Kubernetes
977	DevNation 2016: William Cohen on “Optimizing code for modern processors”
978	Using Vagrant to Get Started with RHEL
979	Converting a .NET application to .NET Core (formerly DNX)
980	Maven mirrors on OpenShift with and without Source to Image (S2I)
981	DevNation 2016: Kyle Buchanan on “Building Progressive Web Apps”
982	A Windows Guy’s Guide: Setting up .NET Core on RHEL
983	Getting MusicStore to run on RHEL
984	Red Hat at the ISO C++ Standards Meeting (March 2016): Library
985	DevNation 2016: Mario Fusco to present “From object-oriented to functional-domain modeling”
986	Installing MongoDB on Red Hat Enterprise Linux
987	Daily Drawing for DevNation 2016 Free Pass!
988	DevNation 2016 evening workshop – Internet of Things – sponsored by Eurotech
989	Red Hat CDK installation in just minutes!
990	DevNation 2016: Tyler Jewell on “An introduction to Eclipse Che: Next-generation Java IDE”
991	How to avoid wasting megabytes of memory a few bytes at a time
992	Rachel Laycock joins DevNation 2016 as a general session speaker
993	DevNation 2016: Sam Atkinson – “What developers can learn from astronauts”
994	.NET on RHEL: I can’t wait, and neither should you
995	Javascript Engine & Performance Comparison (V8, Chakra, Chakra Core)
996	DevNation 2016: Peter Larsen on Developing with OpenShift without the Build Waits
997	DevNation 2016: Rick Wagner on .NET development with Red Hat Enterprise Linux
998	Use Vagrant Landrush to add DNS features to your OpenShift CDK Machine
999	Scalable Microservices through Messaging
1000	Developer Economics Survey Now Open – Share Your Voice
1001	Red Hat Identity Manager: Part 2 – Enterprise PKI Made Easy
1002	.NET Entity Framework Core 1.0 RC2
1003	Three easy steps to get started with Software Collections on RHEL
1004	Configuring NGINX to log HTTP POST data on Linux / RHEL
1005	Creating a custom atomic scan plug-in
1006	JBoss Fuse Tooling – Camel File Validation – Existing, Improved and New
1007	JBoss Fuse Tooling – Support of Global configurations
1008	3 Reasons I Should Build My Containerized Applications on RHEL and OpenShift
1009	JBoss Fuse Tooling – Diagram reworked: New shiny colors! (and more)
1010	.NET on Linux: Which Environment?
1011	ASPNET MVC Core 1.0
1012	Smart light with Arduino in Fedora / RHEL
1013	All Together Now: .NET, RHEL, Hyper-V and VSCode
1014	Jacksonville C++ Core Language Meeting Report
1015	Get started with Node.js v4 using Red Hat Software Collections 2.2 Beta
1016	Announcing v3.10 of the Red Hat Mobile Application Platform including Swift 2.1 and WFM
1017	Persistent Custom MDC Logging in Apache Camel
1018	Announcing DevNation 2016 – San Francisco, get 30% off
1019	TDC Florianópolis, here we go!
1020	New beta: Software Collections 2.2 and Developer Toolset 4.1
1021	Fedora “update testing” with Bodhi
1022	Offline CLI with JBoss EAP 7
1023	Instruction-level Multithreading to improve processor utilization
1024	Getting Started with Release Validation Testing in Fedora QA
1025	Gettitng Started with Release Validation Testing in Fedora QA
1026	Developer interest survey – May 2016
1027	Introducing atomic scan – Container vulnerability detection
1028	Red Hat Identity Manager: Part 1 – Overview and Getting started
1029	Video: Extending Codeless Apps with Rich Integrations using Red Hat Mobile
1030	REST and microservices – breaking down the monolith step by asynchronous step
1031	JavaScript: A Repair Guide
1032	Fedora Media Writer – The fastest way to create Live-USB boot media
1033	Building JBoss Projects with PatternFly and AngularJS
1034	We are heading to Bengaluru.  GIDS here we come!
1035	Red Hat goes DevOps – New certifications for developers
1036	Red Hat at the ISO C++ Standards Meeting (March 2016): Parallelism, Concurrency, and Coroutines
1037	Announcing Microservices Day London – 2016
1038	Is Jenkins showing its age for modern CI/CD? What’s next?
1039	Security update: SAMAS/SamSam Ransomware and JBoss
1040	Different types of microservices?
1041	Redhatloves.net and #dotNETonLinux
1042	It’s almost time for Paris and Devoxx France
1043	Announcing NodeConf London 2016
1044	Continuous Integration and Deployment for Red Hat Mobile Cloud Applications using Circle CI
1045	Red Hat at QCon São Paulo 2016
1046	Announcing v3.9 of the Red Hat Mobile Application Platform including Forms Data Sources
1047	Refine your Linux package maintenance process with ‘rebase-helper’
1048	“Don’t cross the streams”: Thread safety and memory accesses at the speed of light
1049	Integrate OpenShift and Eclipse Che for faster development
1050	Should I learn OSGi? What’s the point?
1051	Important code snippet for Python (and other) developers
1052	Sharing the stage with Microsoft at Build 2016
1053	No-Cost RHEL Developer Subscription now available
1054	Jolokia JVM Monitoring in OpenShift
1055	A Linux Cheat Sheet for Developers
1056	Origins of .NET on Linux: An explanation for Java Developers
1057	We’re heading to Build 2016!
1058	February/March 2016 GNU Toolchain Update
1059	Continuous Development with Automated Testing
1060	What is new in OpenMP 4.5
1061	Review of tzdata Updates for 2015
1062	Take the IoT Developer Survey – 2016
1063	Test-Driven-Development for building APIs in Node.js and Express
1064	Superscalar Execution
1065	Practical micro-benchmarking with ‘ltrace’ and ‘sched’
1066	Testing GCC in the wild
1067	Quickly determine which instruction comes next with Branch Prediction
1068	Keep it small: a closer look at Docker image sizing
1069	JBoss participates in Google Summer of Code 2016
1070	Red Hatters at EclipseCon NA this week
1071	What’s new with JPA 2.1 and Hibernate 5 in JBoss EAP 7
1072	Assembly Line for Computations
1073	Curing a legacy header-ache.
1074	API Management with JBoss Fuse on Openshift and 3scale on Amazon Web Services – Part 1
1075	Reducing Memory Access Times with Caches
1076	Why < cstlib > is more complicated than you might think
1077	GCC 6: -Wmisleading-indentation vs “goto fail;”
1078	New asm flags feature for x86 in GCC 6
1079	10 things to avoid in docker containers
1080	Upcoming features in GCC 6
1081	Programmer’s Model of a Processor Executing Instructions Versus Reality
1082	Apps 101: An Absolute Beginners Guide to Integrating With a Node.js Backend
1083	Project: Remote Dependency Solving
1084	Apps 101: An Absolute Beginner’s Guide to building a Mobile App
1085	Upgrading the GNU C Library within Red Hat Enterprise Linux
1086	Getting started with EAP 7 and JBoss Developer Studio
1087	Red Hat sessions at DevNexus 2016 (Atlanta)
1088	New, no-cost course: Deploying Containerized Applications
1089	Webcast February 10: Fast Container-Based Apps and Performance Tuning with Atomic Enterprise Platform
1090	Update: Red Hat Container Development Kit 2 Beta
1091	Go(lang) meets Fedora
1092	SD Times: The most powerful force in DevOps is changing your company’s culture
1093	abipkgdiff: Ensuring ABI compliance for shared ELF library packages
1094	Angular, React, and Javascript framework fatigue
1095	December ’15/January ’16 GNU Toolchain Update
1096	Survey – Help us help you: tell us about how you work
1097	Using JBoss Fuse and 3scale for API Management
1098	Run your first Java EE application with JBoss EAP 7 Beta
1099	Webcast: Using the Atomic Registry for Secure Container Image Management
1100	Integrate Continuous Integration with OpenShift Enterprise
1101	Screen cast – Getting started with JBoss EAP 7 Beta
1102	Toward a Better Use of C11 Atomics – Part 2
1103	JBoss EAP 7 Beta is now available!
1104	Toward a Better Use of C11 Atomics – Part 1
1105	A Practical Introduction to Docker Container Terminology
1106	React.js with Isotope and Flux
1107	Inter-variable Out-of-SSA Coalescing in GCC
1108	12 Top blog articles of 2015 – don’t miss these
1109	Developers are hitting the streets with DOTS
1110	Using Vagrant Tooling in Eclipse
1111	Do you have what it takes to be an MVC?  And get swag.
1112	Open sourcing Red Hat Mobile Application Platform – Unified Push Server
1113	Got content? Who’s up to work in Red Hat Developer Relations?
1114	DevNation 2016 in San Francisco – Call for Proposals is now open
1115	2015 Year in Review – oh what a year.
1116	October/November 2015 GNU Toolchain Update
1117	It’s time for Portland and Node.js Interactive
1118	An Enterprise Developer’s Journey to the IoT
1119	Re-Watch: Messaging for IoT – Virtual JBoss User Group
1120	CFP: DevConf.cz 2016 Is Looking for Speakers
1121	vJBUG – Learn About JBoss Technology Online!
1122	Externalize HTTP Session Data to the JBoss Data Grid
1123	Open IoT Challange - are you developer enough for this?
1124	DNS for your OpenShift v3 cluster
1125	Deploying PSGI Applications using RHSCL Docker Containers
1126	Red Hat Software Collections 2.1 now generally available
1127	GCC 5.2 and new Developer Toolset 4 now generally available
1128	Get Started: Eclipse and Python with PyDev in Developer Toolset 4.0
1129	Survey request: Help Red Hat build better developer training
1130	Enterprise Developer's Journey to the IoT - join us at QCon
1131	Generating the future - a fun surprise
1132	Repost - Architecting Containers Part 3: How the User Space Affects Your Application | Red Hat Enterprise Linux Blog
1133	Red Hat and Microsoft making .NET on Linux work for Enterprises
1134	Tear Down Data Silos with Mobile Microservices
1135	Devoxx is coming…
1136	Making SCL use a little saner
1137	From DevOps Enterprise Summit:  Capital One is banking on innovation, DevOps and open source
1138	DevOps transforms a retail giant
1139	Containerize your Ruby on Rails/PostgreSQL application with RHSCL Docker images
1140	5 things you need to know about GCC 5 - Developer Toolset Beta
1141	Repost: Red Hat to acquire Ansible
1142	Software Collections 2.1 now in beta - Adds Varnish Cache, nginx
1143	Ready for gcc 5?  Developer Toolset 4 now in beta
1144	You had me at Hello, World
1145	Optimizing Twelve (12) Factor app for Red Hat OpenShift
1146	Accelerating CI/CD with PaaS and containers - DevOps Enterprise session
1147	JBoss Developer Studio 9 - more Docker, OpenShift and WildFly
1148	jbds9
1149	Red Hat joins Node.js Foundation as platinum member
1150	Database Docker images - now beta via Software Collections
1151	Red Hat Software Collections 2.0 Docker images, Beta release
1152	Repost: Gluster and Teiid InfoWorld Bossie Award Winners
1153	Can't We Just Run Boot2Docker in Production?
1154	Controlling resources with cgroups for performance testing
1155	Red Hat Developers Newsletter - August 2015
1156	Repost: Architecting Containers Part 2: Why the User Space Matters
1157	Red Hat: Containers for Grown-Ups - repost from Tools Advisor
1158	Node immersion at NodeConf.eu
1159	Hello World!
1160	DZone guide to the Internet of Things
1161	4 Steps to Maximize Your DevOps and Agile Results
1162	Dirty Tricks: Launching a helper process under memory and latency constraints (pthread_create and vfork)
1163	Containers in the enterprise - Are you ready for this?
1164	Infrastructure and Platform Capabilities
1165	PaaS- Containers Candidate Applications
1166	Repost: Developing process-enabled applications with BPA and BPM tools
1167	What Lies Beneath: A tour of the dark gritty underbelly of OpenJDK
1168	Behind the Internet of Things Middleware Demo at Red Hat Summit
1169	InternetofThings-01
1170	Repost: Software Collections: Ruby – ScriptScribe
1171	Repost - Architecting Containers Part 1: User Space vs. Kernel Space
1172	Webinar:  Continuous delivery with microservices
1173	Using Software Collections Toolset For Your Own Applications
1174	Tuned:  the tuning profile delivery mechanism for RHEL
1175	Repost: What’s Next for Containers? User Namespaces
1176	LTTng Packages now Available for Red Hat Enterprise Linux 7
1177	From Red Hat Summit: Red Hat Container Strategy
1178	Maintain Software Collections easily on thousands of machines using scl register
1179	A peek behind the scenes of OpenSource.com
1180	Red Hat Summit & DevNation Conference Report: Day One
1181	Container development for all: Red Hat’s Container Development Kit
1182	The ARM Arc Part 3
1183	Red Hat Developers - Learn More. Share More. Code More.
1184	Can't attend DevNation this week?  Watch live-streamed keynotes
1185	Get 1v1 performance help at Summit 2015!  Beer, too.
1186	Red Hat at the ISO C++ Standards Meeting (May 2015): Parallelism and Concurrency
1187	Type safe SalesForce Queries (SOQL) in Scala
1188	Lenexa C++ Meeting Report (Core Language)
1189	Red Hat Software Collections 2 - now generally available
1190	Can you run Intel's Data-plane Development Kit (DPDK) in a Docker container?  Yep.
1191	Five different ways to handle leap seconds with NTP
1192	DevNation preview: Enterprise security with Keycloak - from the intranet to mobile
1193	Applied DevOps: Tools and techniques to change your enterprise
1194	Case study repost: Red Hat Software Collections – ScriptScribe
1195	DevNation Talk:    Shenandoah: An ultra-low pause time garbage collector for OpenJDK
1196	Imagine this - the life of an image
1197	Image Lifecycle
1198	DevNation 2015 hot tip: Build distributed, fault-tolerant infrastructure with Apache Mesos
1199	DevNation 2015 hot tip: DevOps with Java EE
1200	Asciidoctor on OpenShift
1201	Testing your software stack without root privileges using cwrap
1202	The OS behind the curtain | Red Hat
1203	Remote debugging with GDB
1204	repost: Proving 6 popular DevOps myths wrong | Opensource.com
1205	Software Collections 2.0 now in BETA - new and shiny
1206	Red Hat Developer Toolset 3.1 now generally available
1207	Scala vs. Node.js as a RESTful backend server
1208	Introducing the Atomic command
1209	DevNation 2015 - agenda is now posted
1210	March in JBoss
1211	Java and Sécurité à Devoxx France (French)
1212	Webinar: Building data-driven solutions for the Internet of Things
1213	Evolving a Mobile-centric Architecture: The Microservices Way
1214	Writing an application that supports DNSSEC in RHEL and Fedora
1215	Accelerating Red Hat Enterprise Linux 7-based Linux Containers with Solarflare OpenOnload
1216	JIT-compilation using GCC 5
1217	Pivoting at Speed to Scaled Agile and DevOps – Chapter 3b
1218	2015 SIIA CODiE Awards - Red Hat garnishes 7 nominations
1219	Internet of Things: insights from Red Hat
1220	RH0056_Lifecycle_IoT_Diagram
1221	Repost: Where Docker security may be headed | Opensource.com
1222	Live Migrating QEMU-KVM Virtual Machines
1223	Repost: Virtual Machines or Containers? Maybe Both?
1224	Announcement: Developer Toolset 3.1 now in beta
1225	Shaping the Performance of a Linux Distro:  Inside Red Hat Enterprise Linux 7
1226	Mark your calendars:  DevNation 2015, June 21-25
1227	Red Hat Announces Pathway to Enterprise-Ready Linux Containers
1228	Introducing the "rhel-tools" for RHEL Atomic Host
1229	Using System Tap to test the GNU C Library
1230	Shouldn't Software Governance Practices be more Descriptive than Prescriptive?
1231	Announcement:  RHEL Atomic Host now generally available
1232	cmocka 1.0
1233	February in JBoss
1234	Alps of MIT
1235	Top 3 Reasons to Run Container-Based Applications on Red Hat Enterprise Linux 7 | Red Hat Enterprise Linux Blog
1236	Inspecting docker activity with socat
1237	Webinar today: Building Enterprise Java Apps in the Cloud
1238	Red Hat ARM Partner Early Access Program enables 64-bit ARM platforms
1239	Repost: Transform Application Delivery with Containers | A Red Hat Virtual Event
1240	Low Latency Performance Tuning for Red Hat Enterprise Linux 7
1241	GCC 5 in Fedora
1242	 The Eclipse Developer's guide to Clean Code (part 1)
1243	 The Eclipse Developer's guide to Clean Code (part 2)
1244	[DevNation Live] - Istio: Canaries and Kubernetes
1245	Role Based Access Control in WildFly 8 (Part 1 of 3)
1246	JBoss Fuse Getting Started Home Loan Demo Part 2
1247	JBoss Fuse Getting Started Home Loan Demo Part 4
1248	JBoss Fuse Getting Started Home Loan Demo Part 3
1249	JBoss Fuse Getting Started Home Loan Demo Part 1
1250	The hardest part of microservices is your data
1251	The Intelligent, Integrated Shipping Company: JBoss Enterprise Business Rules Management System
1252	Kubernetes: Your Next Application Server | DevNation Live
1253	Develop and Deploy faster with Red Hat Enterprise Linux | DevNation Live
1254	Kafka and Debezium | DevNation Live
1255	Knative Deep Dive | DevNation Live
1256	Knative - Going Native and Serverless on Kubernetes | DevNation Live
1257	Getting started with Apache Kafka | DevNation Live
1258	Kafka Streams for Event Driven Microservices | DevNation Live
1259	Kubernetes Patterns: Foundational, Structural, Config and Advanced | DevNation Live
1260	DevNation Live | A Deep Dive into Keycloak
1261	DevNation Live | Hybrid cloud bursting with AMQP
1262	[DevNation Live] - Container pipeline master: Continuous integration + continuous delivery with Jenkins
1263	[DevNation Live] Securing apps and services with Keycloak
1264	[DevNation Live] Feature Toggles & Hypothesis Driven Development
1265	Red Hat Developer Istio Video Series: Number 2 - Istio Pool Ejection
1266	Red Hat Developer Istio Video Series: Number 1 - Istio Route Rules
1267	[DevNation Live] An Introduction to Serverless
1268	[DevNation Live] Serverless and Servicefull Applications - Where Microservices complements Serverless
1269	[DevNation Live] Jakarta EE: The Future of Java EE
1270	[DevNation Live] Enterprise Node.js on OpenShift
1271	Introducing OpenShift.io
1272	Test smarter and gain some time back
1273	[DevNation Live] Camel Riders in the Cloud
1274	[DevNation Live] Secure Spring Boot Microservices with Keycloak
1275	DevNation Live | KubeBoot: Spring Boot deployment on Kubernetes has never been so easy
1276	MicroProfile - Microservices with Java EE
1277	Role Based Access Control in WildFly 8 (Part 1 of 3)
1278	Java EE in the Cloud
1279	5 Minutes to Mobile
1280	JBoss Fuse Getting Started Home Loan Demo Part 5
1281	JBoss Fuse Getting Started Home Loan Demo Part 2
1282	JBoss Fuse Getting Started Home Loan Demo Part 4
