id	tokens
0	OpenShift 4.0 Developer Preview on AWS is up and running
1	How Red Hat developers can create handy shortcuts with Firefox keyword bookmarks
2	Changes made to the Libabigail ABI change analysis framework in 2018
3	Introduction to using libFuzzer with llvm-toolset
4	How to install GCC 8 and Clang/LLVM 6 on Red Hat Enterprise Linux 7
5	Red Hat Enterprise Linux 8 Beta cheat sheet for developers
6	Node.js for Red Hat OpenShift Application Runtimes wins a Devie award
7	Extending support to Spring Boot 2.x for Red Hat OpenShift Application Runtimes
8	Jumpstart your microservices development with MicroProfile Starter (Beta)
9	Using sidecars to analyze and debug network traffic in OpenShift and Kubernetes pods
10	Creating and deploying a Java 8 runtime container image
11	Full API lifecycle management: A primer
12	Time zone data (tzdata): 2018 data format changes and Red Hat Enterprise Linux
13	Podman and Buildah for Docker users
14	Good news: Business automation is not about SOA
15	Register Transfer Language for CRuby
16	Creating a containerized Python/Flask development environment with Red Hat CodeReady Workspaces
17	November 2018 ISO C++ meeting trip report (Core Language)
18	Transitioning Red Hat SSO to a highly-available hybrid cloud deployment
19	Full integration to Salesforce with Red Hat Integration (Part 2)
20	Algorithms != Programs and Programs are not “One size fits all”
21	Announcing Kubernetes-native self-service messaging with Red Hat AMQ Online
22	Effortless API creation with full API lifecycle using Red Hat Integration (Part 1)
23	Red Hat Single Sign-On: Give it a try for no cost!
24	Using a public certificate with Red Hat Single Sign-On/Keycloak
25	IoT edge development and deployment with containers through OpenShift: Part 2
26	Annocheck: Examining the contents of binary files
27	IoT edge development and deployment with containers through OpenShift: Part 1
28	The State Of FaaS and Serverless on Kubernetes
29	Curse you choices! Kubernetes or Application Servers? (Part 3)
30	Podman can now ease the transition to Kubernetes and CRI-O
31	Streamline your JBoss EAP dev environment with Red Hat CodeReady Workspaces: Part 2
32	Using VS Code to develop Spring Boot-based Camel and Red Hat Fuse projects
33	How to configure a JDBC Appender for Red Hat Fuse 7 with Karaf
34	Extending Eclipse Che 7 to use VS Code extensions
35	Serverless and Knative: Installation through Deployment
36	Streamline your JBoss EAP dev environment with Red Hat CodeReady Workspaces: Part 1
37	Integration of storage services (part 6)
38	Modern web applications on OpenShift: Part 3 — Openshift as a development environment
39	Automating tests and metrics gathering for Kubernetes and OpenShift or Kubernetes  (part 3)
40	Podman: Managing pods and containers in a local container runtime
41	Building a Node.js service using the API-first approach
42	Knative: Deep Dive, from Installation to Deployment
43	Open Source Contributor Experience
44	Fall 2018 ISO WG21 C++ Standards Committee meeting trip report
45	sig-big-data: Apache Spark and Apache Airflow on Kubernetes
46	Running Kubernetes in the Federal Government
47	Using Red Hat Application Migration Toolkit to see the impact of migrating to OpenJDK
48	Speeding up Open vSwitch with partial hardware offloading
49	Using a local NuGet server with Red Hat OpenShift
50	Using the Yeoman Camel-Project generator to jump start a project
51	Integration of container platform essentials (Part 5)
52	Leveraging OpenShift or Kubernetes for automated performance tests (part 2)
53	Performance improvements in OVN: Past and future
54	Using a Kotlin-based gRPC API with Envoy proxy for server-side load balancing
55	Eclipse Che 7 is Coming and It’s Really Hot (4/4)
56	Monitoring Node.js Applications on OpenShift with Prometheus
57	Using Kubernetes readiness and liveness probes for health checks with ASP.NET Core 2.2 on OpenShift
58	Eco-Friendly Machine Learning: How the Kubeflow Ecosystem Bootstrapped Itself
59	Eclipse Che 7 is Coming and It’s Really Hot (3/4)
60	Integration of API management details (Part 4)
61	Security Considerations for Container Runtimes
62	Modern business logic tooling workshop, lab 1: Installation
63	Eclipse Che 7 is Coming and It’s Really Hot (2/4)
64	Why Data Scientists Love Kubernetes
65	Will Kubernetes Slow Down My Database?
66	Kubernetes Operators in Depth
67	Introduction to the Kubernetes Operator Framework
68	OpenShift Java S2I builder, now with support for Java 11 and Gradle
69	Eclipse Che 7 is Coming and It’s Really Hot (1/4)
70	Using eXpress Data Path (XDP) maps in RHEL 8 Beta: Part 2
71	All Things Open 2018 – How To Jump Start a Career in Open Source (video)
72	Integration of external application details (Part 3)
73	Building .NET Core container images using S2I
74	Building Red Hat Mobile Applications on your own hardware
75	Red Hat Container Development Kit 3.7 now available
76	Writing better Spring applications using SpringFu
77	CodeReady Workspaces for OpenShift (Beta) – It works on their machines too
78	Processing CloudEvents with Eclipse Vert.x
79	Demystifying the Red Hat Decision Manager and Process Automation Manager Remote Client
80	Red Hat KubeCon Seattle 2018 Events & Demos
81	How to install Java 8 an 11 on Red Hat Enterprise Linux 8 Beta
82	IP packet buffering in OVN
83	Kubernetes: Your Next Application Server
84	Achieving high-performance, low-latency networking with XDP: Part I
85	How to integrate a remote Red Hat AMQ 7 cluster on Red Hat JBoss EAP 7
86	Intro to Apache Kafka and Kafka Streams for Event-Driven Microservices on DevNation Live
87	Announcing .NET Core 2.2 for Red Hat Platforms
88	Quickly try Red Hat Process Automation Manager in your cloud
89	XML Language Server and the VSCode Extension
90	How Kotlin’s coroutines improve code readability
91	Network debugging with eBPF (RHEL 8 Beta)
92	Common architectural elements for modern integration architectures
93	Managing containerized system services with Podman
94	Announcing the Red Hat OpenShift extension for Visual Studio Code: Public Preview
95	How integration is key to customer experience (Part 1)
96	What, No Python in RHEL 8 Beta?
97	Solving the challenges of debugging microservices on a container platform
98	Announcing: Extending support to Spring Boot for Red Hat OpenShift Application Runtimes
99	Extending support to Spring Boot for Red Hat OpenShift Application Runtimes
100	The Non-complexity of /etc/nsswitch.conf
101	Leveraging OpenShift or Kubernetes for automated performance tests (part 1)
102	Eclipse MicroProfile for Spring Boot developers
103	Containers without daemons: Podman and Buildah available in RHEL 7.6 and RHEL 8 Beta
104	Support Lifecycle for Clang/LLVM, Go, and Rust
105	Quickly try Red Hat Decision Manager in your Cloud
106	Free Online Java EE Development Course From Red Hat Available Now
107	Microcontainers for Unit Testing
108	Introducing Application Streams in RHEL 8
109	Red Hat Enterprise Linux 8 Beta is here!
110	Introducing CodeReady Linux Builder
111	Python in RHEL 8
112	Upcoming Book: Vert.x in Action (MEAP)
113	PHP 7.2, Node.js 10, NGINX 1.14 and others now GA for RHEL
114	GCC 8.2 now GA for Red Hat Enterprise Linux
115	Clang/LLVM 6.0, Go 1.10, and Rust 1.29 NOW GA for RHEL
116	Improved support information for RHEL on Azure: sosreport plugin updated
117	Why you should care about RISC-V
118	Reducing the startup overhead of SystemTap monitoring scripts with syscall_any tapset
119	How to create an Open Virtual Network distributed gateway router
120	Locating special folders in cross-platform .NET applications
121	Diagnosing Java applications on the fly with Byteman
122	Migrating from Oracle JDK to OpenJDK on Red Hat Enterprise Linux: What you need to know
123	How to manually copy SSH public keys to servers on Red Hat Enterprise Linux
124	Spring Boot-enabled business process automation with Red Hat Process Automation Manager
125	Analyzing and reducing SystemTap’s startup cost for scripts
126	How to run Kafka on Openshift, the enterprise Kubernetes, with AMQ Streams
127	How to install Ansible Tower on Red Hat OpenShift
128	Welcome Apache Kafka to the Kubernetes Era!
129	GCC 8 and tools now in beta for Red Hat Enterprise Linux 6 and 7
130	Clang/LLVM 6.0, Go 1.10, and Rust 1.29 now in beta for Red Hat Enterprise Linux
131	Newest PHP, Varnish Cache, MySQL, NGINX, Node.js, and Git now in beta
132	Modern web applications on OpenShift: Part 2 — Using chained builds
133	Introduction to Linux interfaces for virtual networking
134	Modernize your application deployment with Lift and Shift
135	Announcing: Thorntail 2.2 General Availability
136	Deploying MicroProfile apps on Microsoft Azure using the Azure Open Service Broker
137	EclipseCon Europe: Che sessions by Red Hatters
138	EventFlow: Event-driven microservices on OpenShift (Part 1)
139	Securing .NET Core on OpenShift using HTTPS
140	Use Groovy to customize the Maven build process
141	Red Hat Container Development Kit 3.6 now available
142	Announcing Red Hat Developer Studio 12.9.0.GA and JBoss Tools 4.9.0.Final for Eclipse 2018-09
143	Integrating third-party identity providers with Red Hat 3scale API Management
144	Configuring NGINX for OAuth/OpenID Connect SSO with Keycloak/Red Hat SSO
145	Modern Web Applications on OpenShift: Part 1 – Web apps in two commands
146	Are App Servers Dead in the Age of Kubernetes? (Part 2)
147	Patterns for distributed transactions within a microservices architecture
148	Dynamic IP address management in Open Virtual Network (OVN): Part Two
149	Source versus binary S2I workflows with Red Hat OpenShift Application Runtimes
150	Running Microsoft SQL Server on Red Hat OpenShift
151	The future of Java and OpenJDK updates without Oracle support
152	How to set up LDAP authentication for the Red Hat AMQ 7 management console
153	Observe what your Istio mesh is doing with Kiali
154	Troubleshooting FDB table wrapping in Open vSwitch
155	Configuring the MongoDB WiredTiger memory cache for RHMAP
156	Red Hat Application Development I: Programming Java EE (JB183) course now available
157	The rise of non-microservices architectures
158	Kubernetes is the new operating environment (Part 1)
159	Dynamic IP Address Management in Open Virtual Network (OVN): Part One
160	Asynchronous communication between microservices using AMQP and Vert.x
161	Intro to Podman (Red Hat Enterprise Linux 7.6 Beta)
162	Securing apps and services with Keycloak (Watch DevNation Live video)
163	Auto-generating news and publishing it to WordPress with Apache Camel
164	Eclipse MicroProfile and Red Hat Update: Thorntail and SmallRye
165	Reducing data inconsistencies with Red Hat Process Automation Manager
166	How to integrate A-MQ 6.3 on Red Hat JBoss EAP 7
167	How to enable sudo on RHEL
168	Improving rsync performance with GlusterFS
169	How to install Python 3 on RHEL
170	Firewalld: The Future is nftables
171	Autoscaling the Red Hat Cache Service on OpenShift
172	Setting up RBAC on Red Hat AMQ Broker
173	OKD: Renaming of OpenShift Origin with 3.10 release
174	Container-native integration testing
175	Natively compile Java code for better startup time
176	Collaboration in open source license enforcement — a community movement is happening
177	Announcing the DevConf.US 2018 developer conference
178	Detecting credit card fraud with Red Hat Decision Manager 7
179	Sabre chooses Red Hat OpenShift for cloud-native DevOps platform
180	Announcing Red Hat Application Migration Toolkit 4.1.0: Now with technical reports
181	Improving .NET Core Kestrel performance using a Linux-specific transport
182	How to migrate your SOAP web service to REST with Camel
183	The wait is over: JBoss Web Server 5 with Tomcat 9 is here!
184	July 19th DevNation Live: Container pipeline master: Continuous integration + continuous delivery with Jenkins
185	Announcing updated Red Hat Developer Studio and Container Development Kit
186	Announcing Red Hat Developer Studio 12.0.0.GA and JBoss Tools 4.6.0.Final for Eclipse Photon
187	How to call the OpenShift REST API from C#
188	Smart-Meter Data Processing Using Apache Kafka on OpenShift
189	Contract-First API Design with Apicurio and Red Hat Fuse/Camel
190	A Beginner’s Guide to Kubernetes (PodCTL Podcast #38)
191	Apache Camel URI Completion with Java DSL
192	How to install Clang/LLVM 5 and GCC 7 on RHEL
193	Using OpenShift to deploy .NET Core applications
194	Next DevNation Live: Feature toggles and hypothesis-driven development, July 5th, 12pm EDT
195	June 2018 ISO C++ Meeting Trip Report (Core Language)
196	Why Kubernetes Is the New Application Server
197	DesOps is “DevOps 2.0”
198	Using Red Hat Data Grid to power a multi-cloud real-time game
199	DesOps – The Next Wave in Design
200	Next DevNation Live: Advanced Microservices Tracing with Jaeger, June 21st, 12pm EDT
201	Troubleshooting Open vSwitch DPDK PMD Thread Core Affinity
202	Red Hat Data Grid on Three Clouds (the details behind the demo)
203	Announcing .NET Core 2.1 for Red Hat Platforms
204	Debugging Memory Issues with Open vSwitch DPDK
205	Using the STOMP Protocol with Apache ActiveMQ Artemis Broker
206	Remotely Debug an ASP.NET Core Container Pod on OpenShift with Visual Studio
207	EDI Transformations with Fuse Ignite and Trace Transformer
208	Building Container-Native Node.js Applications with Red Hat OpenShift Application Runtimes and Istio
209	Eclipse Che 6.6 Release Notes
210	Next DevNation Live: Your Journey to a Serverless World—An Introduction to Serverless, June 7th, 12pm EDT
211	Monitoring Red Hat AMQ 7 with the jmxtrans Agent
212	How to install Python Flask on Red Hat Enterprise Linux 7
213	Red Hat Fuse 7 Is Now Available
214	An Introduction to Red Hat Application Migration Toolkit
215	Red Hat Summit: Building production-ready containers
216	Introducing the Kafka-CDI Library
217	Adding API Gateway Policies Now Easier With Red Hat 3scale API Management
218	How to install Red Hat CDK 3.4 on Fedora 28
219	Using .NET Core in a “Disconnected” Environment
220	Application Modernization and Migration Tech Talk + Scotland JBug Meetup
221	Simplify Local Variable Type Definition Using the Java 10 var Keyword
222	Detecting String Truncation with GCC 8
223	Customizing an OpenShift Ansible Playbook Bundle
224	Using Ansible Galaxy Roles in Ansible Playbook Bundles
225	Container Testing in OpenShift with Meta Test Family
226	Red Hat Summit: Lowering the risk of monolith to microservices
227	Apache Camel URI completion: easy installation for Eclipse, VS Code, and OpenShift.io
228	Red Hat Summit: An Eventful Tour from Enterprise Integration to Serverless
229	Scaling AMQ 7 Brokers with AMQ Interconnect
230	Next DevNation Live: Serverless and Servicefull Applications: Where Microservices Complements Serverless, May 17th, 12pm EDT
231	Red Hat Summit: Functions as a Service with OpenWhisk and OpenShift
232	How to Debug Your Node.js Application on OpenShift with Chrome DevTools
233	Watch over 100 Red Hat Summit 2018 session videos online
234	Making the Operation of Code More Transparent and Obvious
235	“Use the dynamic tracing tools, Luke”
236	Red Hat Summit: An introduction to OpenShift.io
237	Red Hat Summit 2018 Burr Sutter Demo
238	Red Hat Summit: Clouds today, serverless tomorrow
239	Red Hat Summit: Containers, Microservices, and Serverless Computing
240	From Localhost to the Cloud: Helping Organizations Develop Applications in a Hybrid World
241	Celebrating the builders
242	Red Hat Summit: Developing .NET Core apps on Red Hat OpenShift
243	Getting Started with Istio and Jaeger on Your Laptop
244	Announcing AMQ Streams: Apache Kafka on OpenShift
245	Istio Service Mesh Blog Series Recap
246	MicroProfile Status in Version 1.3
247	Externalized HTTP Session in an OpenShift 3.9 Environment
248	Eclipse Che’s Plans for 2018
249	Announcing GA for latest Software Collections, Developer Toolset, Compilers
250	Next DevNation Live: Jakarta EE: The Future of Java EE, May 3rd, 12pm EDT
251	Istio Egress: Exit Through the Gift Shop
252	What Does the New JBoss EAP CD Release Stream Mean for Developers?
253	Meeting Red Hat authors at Red Hat Summit 2018
254	March 2018 ISO C++ Meeting Trip Report (SG1: Concurrency and Parallelism)
255	Red Hat Summit Spotlight: Getting Started with Cloud-Native Apps Lab
256	Inside a Red Hat Open Innovation Labs Residency (Part 3)
257	An API Journey: From Idea to Deployment the Agile Way–Part III
258	Red Hat Summit 2018: Trends in cloud-native development
259	Automating AMQ 7 High Availability Deployment
260	Istio Smart Canary Launch: Easing Into Production
261	Announcing new product updates of CDK 3.4, DevStudio 11.3, DevSuite 2.3
262	Announcing Developer Studio 11.3.0.GA, JBoss Tools 4.5.3 for Eclipse Oxygen.3a
263	Red Hat introduces JDK 10
264	Jakarta EE is officially out
265	SystemTap’s BPF Backend Introduces Tracepoint Support
266	Elytron: A New Security Framework in WildFly/JBoss EAP
267	An API Journey: From Idea to Deployment the Agile Way–Part II
268	Expanding architectural choices to better arm Red Hat Enterprise Linux developers
269	Next DevNation Live: Enterprise Node.js on OpenShift, April 19th, 12 p.m. EDT
270	When Vert.x Meets Reactive eXtensions (Part 5 of Introduction to Vert.x)
271	Red Hat Summit 2018: Learn how other developers are producing cloud-native applications
272	Istio Dark Launch: Secret Services
273	State of Functions-as-a-Service on Kubernetes (OpenShift Commons Briefing)
274	Zero to Express on OpenShift in Three Commands
275	Red Hat Summit 2018: Speakers on the forefront of Cloud-Native application development
276	Deallocate an Azure VM Using the Azure CLI on RHEL
277	Bringing Coolstore Microservices to the Service Mesh: Part 2–Manual Injection
278	An API Journey: from idea to deployment the Agile way – Part I
279	Red Hat Summit 2018: Getting Started with Modern Application Development
280	Istio Chaos Engineering: I Meant To Do That
281	Accessing Data – The Reactive Way
282	A Cloud Lab Environment in a Backpack
283	Red Hat Summit 2018: Develop Secure Apps and Services
284	Red Hat scripting languages for beta: adds Ruby 2.5, Perl 5.26; updates PHP 7.1.8
285	Red Hat adds/updates web tools for beta: HAProxy 1.8, Varnish 5.0, Apache httpd 2.4
286	New Red Hat compilers toolsets in beta: Clang and LLVM, GCC, Go, Rust
287	Red Hat open source databases in beta: Adds PostgreSQL 10, MongoDB 3.6; updates MySQL 5.7
288	Bringing Coolstore Microservices to the Service Mesh: Part 1 – Exploring Auto-injection
289	Next DevNation Live: Test Smarter and Gain Some Time Back, April 5th, 12pm EDT
290	Unit Testing for Camel Rest DSL and Spring Boot
291	Setting Up a Failover Scenario Using Apache Camel ZooKeeper
292	Istio Tracing & Monitoring: Where are you and how fast are you going?
293	Red Hat OpenShift Container Platform Load Testing Tips
294	March 2018 ISO C++ Meeting Trip Report (Core Language)
295	Some Rest with Vert.x
296	Analyzing Changes to the Binary Interface Between the Linux Kernel and its Modules
297	Integrating Intercede RapID with Red Hat Mobile and OpenShift
298	Deploying a Spring Boot App with MySQL on OpenShift
299	Istio Circuit Breaker: When Failure Is An Option
300	Writing Your First Camel Spring Boot Project With the Rest DSL
301	GNU Toolchain Update – Spring 2018
302	Non-root Open vSwitch in RHEL
303	Eclipse Vert.x Application Configuration
304	Towards The Ruby 3×3 Performance Goal
305	Recommended compiler and linker flags for GCC
306	Inside a Red Hat Open Innovation Labs Residency (Part 2)
307	Istio Circuit Breaker: How To Handle (Pool) Ejection
308	Getting Started with Red Hat Decision Manager 7
309	Single Sign-On Made Easy with Keycloak / Red Hat SSO
310	Open vSwitch-DPDK: How Much Hugepage Memory?
311	Usability improvements in GCC 8
312	Next DevNation Live: Camel Riders in the Cloud, March 15th, 12pm EDT
313	What is a KJAR?
314	Introduction to Eclipse Vert.x - My First Vert.x Application
315	Istio Route Rules: Telling Service Requests Where To Go
316	3Scale by Red Hat Integration with ForgeRock using OpenID Connect
317	Announcing: Node.js General Availability in Red Hat OpenShift Application Runtimes
318	3scale ActiveDocs and OAuth 2.0
319	Get Started on Process Driven Development with JBoss BPM
320	MicroProfile Fault Tolerance in WildFly Swarm
321	Introducing conu - Scripting Containers Made Easier
322	Red Hat Summit 2018 to focus on Modern App Development
323	3scale by Red Hat API and Identity Management Series
324	Introduction to Istio; It Makes A Mesh Of Things
325	Develop Cloud-native Applications with MicroProfile (Config & Health Check) and OpenShift
326	IoT Developer Survey - Deadline March 5, 2018
327	Custom Hibernate ORM and Hibernate Search on WildFly Swarm
328	Next DevNation Live: Secure Spring Boot Microservices with Keycloak, March 1st, 12pm EST
329	Get Started with Red Hat JBoss Fuse 7 Tech Preview 3 Today!
330	Whisking Functions with Promises using OpenWhisk
331	A Practical Introduction to Container Terminology
332	Using Byteman to Find Out Why the TimeZone Changed on a Java App Server
333	Eclipse CheConf 2018 - Join the live stream February 21st at 10 am EST
334	Annobin - Storing Extra Information in Binaries
335	New Release of Red Hat JBoss Data Virtualization.
336	Scheduling Voxxed Days Zurich 2018 with OptaPlanner
337	Apache Camel URI completion in VS Code XML Editor and Eclipse Che
338	DevNation Live Tech Talk: KubeBoot - Spring Boot deployment on Kubernetes
339	Java Class Metadata: A  User Guide
340	Red Hat Container Development Kit (CDK) With Nested KVM
341	JBoss Data Virtualization: Integrating with Impala on Cloudera
342	Avoiding Windows rsync permission problems with Red Hat JBoss Developer Studio
343	SnowCamp 2018 Trip Report
344	Use Private NPM modules with RHMAP
345	Integrate  RH-SSO 7.x with Liferay DXP using SAML
346	Apache Camel URI completion in Eclipse XML Editor
347	Announcing Developer Tool Updates: DevSuite, DevStudio, CDK, more
348	Announcing Developer Studio 11.2.0.GA and JBoss Tools 4.5.2.Final for Eclipse Oxygen.2
349	Red Hat DevNation Live Tech Talk - Istio: Canaries and Kubernetes
350	Extend Red Hat JBoss BPM Suite through the Service Repository
351	Cloud-native development with Microprofile 1.2
352	Inside a Red Hat Open Innovation Labs Residency - Part 1
353	Running Microsoft SQL Server pod on OpenShift
354	3Scale Developer Portal Docs Per Application
355	JUnit 5 support lands in Eclipse Vert.x for testing asynchronous operations
356	Structured application logs in OpenShift
357	No-cost developer subscriptions to Red Hat Enterprise Linux for Command Line Heroes
358	Enabling Byteman Script with Red Hat JBoss Fuse and AMQ - Part 2
359	Red Hat Certification: for developers too!
360	It’s Time To Accelerate Your Application Development With Red Hat JBoss Middleware And Microsoft Azure
361	Containerizing SQL DB changes with Flyway, Kubernetes, and OpenShift
362	Beta Testing in the Ever-Changing World of Automation
363	JBoss Data Virtualization on OpenShift: Integrating a Remote SQL Server Database
364	SCTP Stream Schedulers and User Message Interleaving
365	Enabling SAML-based SSO with Remote EJB through Picketlink
366	Develop and Deploy on OpenShift Online Starter using Red Hat JBoss Developer Studio
367	Enabling Byteman Script with Red Hat JBoss Fuse and AMQ - Part1
368	Create a scalable REST API with Falcon and RHSCL
369	Securing AMQ7 Brokers with SSL (part 2)
370	Which Camel DSL to Choose and Why?
371	Understanding Ansible Tower Isolated Nodes
372	Debug your OpenShift Java application with Microsoft VSCode and Red Hat CDK
373	3scale Developer Portal signup flows
374	What are BPF Maps and how are they used in stapbpf
375	New with JBoss EAP 7.1: Credential Store
376	Introducing stapbpf - SystemTap's new BPF backend
377	Using Camel-Undertow component supporting http2 connection
378	Inter-Reactive Kotlin Applications
379	Keycloak Identity Brokering with OpenShift
380	Hexagonal Architecture  as a Natural fit for Apache Camel
381	The State of Microservices Survey 2017 - Eight trends you need to know
382	How to customize OpenShift RBAC permissions
383	Open vSwitch without stale ports
384	Steps to replace nip.io with xip.io in CDK/Minishift
385	Red Hat at the ISO C++ Standards Meeting (November 2017): Parallelism and Concurrency
386	Securing AMQ7 Routers with SSL
387	Provisioning with Red Hat Satellite 6
388	Flexible Images or Using S2I for Image Configuration
389	Example of using Ansible to update Container Native Storage
390	Accelerating the development of Node.js using OpenShift
391	Dynamically Creating Java Keystores in OpenShift
392	Developing .NET Core 2.0 Web Applications on OpenShift
393	Configuring mKahaDB  persistence storage for ActiveMQ
394	HOW-TO setup 3scale OpenID Connect (OIDC) Integration with RH SSO
395	JBoss Weekly 17 November 2017
396	Building Declarative Pipelines with OpenShift DSL Plugin
397	Monitoring RHGS
398	ARM TechCon 2017 - Embedded, IoT, Networking, and more...
399	How to deploy Java application with Docker
400	Red Hat Sessions at Devoxx 2017
401	Wiping the Slate Clean with the OpenShift Container Platform
402	Speed up your Python using Rust
403	Best practices with React and Redux web application development
404	Red Hat Developer Program introduces new topic on secure programming
405	Red Hat enhances no-cost RHEL developer subscription with SAP Solution development
406	MicroProfile at EclipseCon Europe
407	Getting Started with GraphQL using GitHub API
408	Interfaces in Java
409	The GDB Python API
410	Red Hat introduces JDK 9
411	CloudForms: Manage your IT and Hybrid Cloud through a single platform
412	Open IoT Challenge – CFP deadline next week
413	Red Hat introduces JUnit5
414	5 Pillars of a Successful Java Web Application (Part 3/3)
415	Announcing Red Hat Developer Studio 11.1.0.GA and JBoss Tools 4.5.1.Final for Eclipse Oxygen.1A
416	Red Hat extends container development tooling with updated DevSuite, DevStudio, CDK
417	5 Pillars of a Successful Java Web Application (Part 2/3)
